{
  "schema_version": "CPY-BASELINE-1",
  "manifest_id": "CPY-BASELINE-2026-08-18-0cf406b",
  "created_at": "2026-08-18T19:01:14-04:00",
  "rlvgl_source": {
    "commit": "0cf406bb22509f1040af6a772d0476a614c7bd9c",
    "worktree_clean": true,
    "cargo_manifest_count": 53,
    "cargo_manifest_set_sha256": "sha256:afb1cf49c3dbe410cc20c37b196d117e03e023f35934e73a1ef32c3b0053608e"
  },
  "vendored_sources": [
    {
      "name": "LVGL",
      "path": "lvgl",
      "commit": "5a89ce8a27505389a0e74814fba79db69718512c",
      "worktree_clean": true
    },
    {
      "name": "MicroPython",
      "path": "vendor/micropython",
      "commit": "e0e9fbb17ed6fd06bb76e266ae554784c9c80804",
      "worktree_clean": true
    }
  ],
  "authorities": [
    {
      "family": "MPY",
      "document_id": "MPY-00-CONCEPTS",
      "source_path": "docs/concepts/MPY-00-CONCEPTS.md",
      "revision": "0.2.5",
      "revision_basis": "document-changelog",
      "status": "Ratified",
      "source_commit": "056bc663ff9d765d087761ef26bdf9b0bf27c453"
    },
    {
      "family": "MPY",
      "document_id": "MPY-01-INTROSPECTION-BASELINE",
      "source_path": "docs/concepts/MPY-01-INTROSPECTION-BASELINE.md",
      "revision": "0.2.0",
      "revision_basis": "document-changelog",
      "status": "Ratified",
      "source_commit": "74dc28a45c919aafa6c3addc00fbaffff6022d36"
    },
    {
      "family": "MPY",
      "document_id": "MPY-02-IDENTITY-VALUES-PROTOCOL",
      "source_path": "docs/concepts/MPY-02-IDENTITY-VALUES-PROTOCOL.md",
      "revision": "0.6.0",
      "revision_basis": "document-changelog",
      "status": "Ratified",
      "source_commit": "b4c6a78c6dd358023b89bd8cab4d58b266e7fc4a"
    },
    {
      "family": "MPY",
      "document_id": "MPY-03-RUNTIME-REGISTRY-ACTOR-CREATION",
      "source_path": "docs/concepts/MPY-03-RUNTIME-REGISTRY-ACTOR-CREATION.md",
      "revision": "0.4.0",
      "revision_basis": "document-changelog",
      "status": "Ratified",
      "source_commit": "0c9a96e1a9f01eac821ae3ecac224c32a1ca6dc5"
    },
    {
      "family": "MPY",
      "document_id": "MPY-04-STAGE-DIRECTIONS-INTROSPECTION",
      "source_path": "docs/concepts/MPY-04-STAGE-DIRECTIONS-INTROSPECTION.md",
      "revision": "0.10.0",
      "revision_basis": "document-changelog",
      "status": "Ratified",
      "source_commit": "2205c2fbf04537859f1dd943e82c85f24c379566"
    },
    {
      "family": "MPY",
      "document_id": "MPY-05-CUES-SAFE-SCHEDULING",
      "source_path": "docs/concepts/MPY-05-CUES-SAFE-SCHEDULING.md",
      "revision": "0.2.1",
      "revision_basis": "document-changelog",
      "status": "Ratified",
      "source_commit": "8fcc4419a1b6e384babe9629e1d002cd916b3bef"
    },
    {
      "family": "LPAR",
      "document_id": "LPAR-00-CONCEPTS",
      "source_path": "docs/concepts/LPAR-00-CONCEPTS.md",
      "revision": null,
      "revision_basis": "source-commit",
      "status": "Ratified",
      "source_commit": "5187ce097f18fbea04ef5c4f5622126d330f5e67"
    },
    {
      "family": "LPAR",
      "document_id": "LPAR-01-BASELINE",
      "source_path": "docs/concepts/LPAR-01-BASELINE.md",
      "revision": null,
      "revision_basis": "source-commit",
      "status": "Ratified",
      "source_commit": "5187ce097f18fbea04ef5c4f5622126d330f5e67"
    },
    {
      "family": "LPAR",
      "document_id": "LPAR-02-OBJECT-SUBSTRATE",
      "source_path": "docs/concepts/LPAR-02-OBJECT-SUBSTRATE.md",
      "revision": null,
      "revision_basis": "source-commit",
      "status": "Ratified",
      "source_commit": "5187ce097f18fbea04ef5c4f5622126d330f5e67"
    },
    {
      "family": "LPAR",
      "document_id": "LPAR-03-INVALIDATION-DISPLAY",
      "source_path": "docs/concepts/LPAR-03-INVALIDATION-DISPLAY.md",
      "revision": null,
      "revision_basis": "source-commit",
      "status": "Ratified",
      "source_commit": "5187ce097f18fbea04ef5c4f5622126d330f5e67"
    },
    {
      "family": "LPAR",
      "document_id": "LPAR-04-EVENT-FOCUS-INPUT",
      "source_path": "docs/concepts/LPAR-04-EVENT-FOCUS-INPUT.md",
      "revision": null,
      "revision_basis": "source-commit",
      "status": "Ratified",
      "source_commit": "5187ce097f18fbea04ef5c4f5622126d330f5e67"
    },
    {
      "family": "LPAR",
      "document_id": "LPAR-07-STYLE-THEME",
      "source_path": "docs/concepts/LPAR-07-STYLE-THEME.md",
      "revision": null,
      "revision_basis": "source-commit",
      "status": "Ratified",
      "source_commit": "5187ce097f18fbea04ef5c4f5622126d330f5e67"
    },
    {
      "family": "LPAR",
      "document_id": "LPAR-10-LAYOUT",
      "source_path": "docs/concepts/LPAR-10-LAYOUT.md",
      "revision": null,
      "revision_basis": "source-commit",
      "status": "Ratified",
      "source_commit": "5187ce097f18fbea04ef5c4f5622126d330f5e67"
    },
    {
      "family": "LPAR",
      "document_id": "LPAR-15-CANVAS-MEDIA-PROPERTY-OBSERVER",
      "source_path": "docs/concepts/LPAR-15-CANVAS-MEDIA-PROPERTY-OBSERVER.md",
      "revision": null,
      "revision_basis": "source-commit",
      "status": "Ratified",
      "source_commit": "5187ce097f18fbea04ef5c4f5622126d330f5e67"
    },
    {
      "family": "WLD",
      "document_id": "WLD-00-CONCEPTS",
      "source_path": "docs/wayland/WLD-00-CONCEPTS.md",
      "revision": "0.2.1",
      "revision_basis": "document-changelog",
      "status": "Ratified",
      "source_commit": "9eb560ee5e0a395eddd2524f0bcafc25bc3b7991"
    }
  ],
  "rust": {
    "rustc_version": "rustc 1.96.0 (ac68faa20 2026-05-25)",
    "cargo_version": "cargo 1.96.0 (30a34c682 2026-05-25)",
    "host_triple": "x86_64-apple-darwin",
    "target_triples": [
      "x86_64-apple-darwin",
      "x86_64-unknown-linux-gnu",
      "aarch64-unknown-linux-gnu",
      "armv7-unknown-linux-gnueabihf"
    ]
  },
  "cpython": {
    "minimum_minor": "3.13",
    "required_minors": [
      "3.13",
      "3.14"
    ],
    "builds": [
      {
        "version": "3.13.15",
        "target_triple": "x86_64-apple-darwin",
        "gil_mode": "conventional",
        "abi_mode": "version-specific",
        "build_flags": [],
        "qualification_state": "selected",
        "source_reference": "https://www.python.org/downloads/release/python-31315/"
      },
      {
        "version": "3.13.15",
        "target_triple": "x86_64-unknown-linux-gnu",
        "gil_mode": "conventional",
        "abi_mode": "version-specific",
        "build_flags": [
          "--enable-shared"
        ],
        "qualification_state": "selected",
        "source_reference": "docker.io/library/python:3.13.15-slim-trixie@sha256:8fef26df932191825664e4957ff488c96dfe64918327634a357a55facbc994d3"
      },
      {
        "version": "3.13.15",
        "target_triple": "aarch64-unknown-linux-gnu",
        "gil_mode": "conventional",
        "abi_mode": "version-specific",
        "build_flags": [
          "--enable-shared"
        ],
        "qualification_state": "selected",
        "source_reference": "docker.io/library/python:3.13.15-slim-trixie@sha256:7e6269297b5711841583c4d018ca3b151f299fc8e707bd0188c1397f466f377f"
      },
      {
        "version": "3.13.15",
        "target_triple": "armv7-unknown-linux-gnueabihf",
        "gil_mode": "conventional",
        "abi_mode": "version-specific",
        "build_flags": [
          "--enable-shared"
        ],
        "qualification_state": "selected",
        "source_reference": "docker.io/library/python:3.13.15-slim-trixie@sha256:9a367cdb4045979dae8aec1b7d2550ee4a574068441a55fab04731f292f47bdb"
      },
      {
        "version": "3.14.7",
        "target_triple": "x86_64-apple-darwin",
        "gil_mode": "conventional",
        "abi_mode": "version-specific",
        "build_flags": [],
        "qualification_state": "selected",
        "source_reference": "https://www.python.org/downloads/release/python-3147/"
      },
      {
        "version": "3.14.7",
        "target_triple": "x86_64-unknown-linux-gnu",
        "gil_mode": "conventional",
        "abi_mode": "version-specific",
        "build_flags": [
          "--enable-shared"
        ],
        "qualification_state": "selected",
        "source_reference": "docker.io/library/python:3.14.7-slim-trixie@sha256:d6e0850f13fda0e2305d4c3c1c2f7930fe1042d34ddd958e49bba6ef685d0bb2"
      },
      {
        "version": "3.14.7",
        "target_triple": "aarch64-unknown-linux-gnu",
        "gil_mode": "conventional",
        "abi_mode": "version-specific",
        "build_flags": [
          "--enable-shared"
        ],
        "qualification_state": "selected",
        "source_reference": "docker.io/library/python:3.14.7-slim-trixie@sha256:c65a4a1140b75416bbc7f28807f82a3746bd6567645d5848123b6a6587f86962"
      },
      {
        "version": "3.14.7",
        "target_triple": "armv7-unknown-linux-gnueabihf",
        "gil_mode": "conventional",
        "abi_mode": "version-specific",
        "build_flags": [
          "--enable-shared"
        ],
        "qualification_state": "selected",
        "source_reference": "docker.io/library/python:3.14.7-slim-trixie@sha256:f63fe55edc3b4f775177545df484594f73e41d9d74b5746398b92f0a33ee2381"
      }
    ]
  },
  "binding_tools": {
    "pyo3_version": "0.28.3",
    "pyo3_checksum": "sha256:91fd8e38a3b50ed1167fb981cd6fd60147e091784c427b8f7183a7ee32c31c12",
    "pyo3_features": [
      "extension-module",
      "macros"
    ],
    "maturin_version": "1.13.0",
    "maturin_sha256": "sha256:96c7b56013137f26de67a98cac8c6e544fb640ea650d5ded53fbe5327f72108f"
  },
  "root_filesystems": [
    {
      "id": "trixie-armhf-cp31315",
      "digest": "sha256:9a367cdb4045979dae8aec1b7d2550ee4a574068441a55fab04731f292f47bdb",
      "image_reference": "docker.io/library/python:3.13.15-slim-trixie",
      "base_digest": "sha256:f445f0eca2d6fa4c1525039c38dbea85a8a4149a88e2714a96e1e127bbb036ae",
      "source_revision": "3cb2fbae63fab2184343a01e4bd63a7540462999",
      "distribution": "Debian",